{"$schema":"https://json-schema.org/draft/2020-12/schema","title":"Paciente sintético","type":"object","additionalProperties":false,"required":["patient_id","synthetic","age_years","conditions","allergies","current_medications","completed_exam_codes","pending_exam_codes","last_review_date"],"properties":{"patient_id":{"type":"string","pattern":"^PAT-SYN-[0-9]{3}$"},"synthetic":{"const":true},"age_years":{"type":"integer","minimum":18,"maximum":120},"conditions":{"type":"array","minItems":1,"items":{"enum":["HAS","DM2"]},"uniqueItems":true},"allergies":{"type":"array","items":{"type":"string"}},"current_medications":{"type":"array","items":{"type":"string"}},"completed_exam_codes":{"type":"array","items":{"type":"string"},"uniqueItems":true},"pending_exam_codes":{"type":"array","items":{"type":"string"},"uniqueItems":true},"last_review_date":{"type":"string","format":"date"}}}

